<?xml version="1.0"?>

<session 
	format-version="3" 
	xmlns:xsi="http://www.w3.org/2001/XMLSchema-instance"
	xsi:noNamespaceSchemaLocation="session.xsd">

	<!-- Folders -->

	<folder>
		<name>Datasets</name>
		<id>folder-0</id>
		<parent></parent>
		<children>
		</children>
	</folder>
	
	<folder>
		<name>IlluminaTeratospermiaHuman6v1_BS1</name>
		<id>folder-1</id>
		<parent>folder-0</parent>
		<children>
		</children>
	</folder>

</session>
